{
  "resource_id": "K1-L28-P01-catch-up-choice-board",
  "lesson_id": "K1-L28",
  "title": "Catch-up Choice Board",
  "purpose": "Support the primary activity for God Made and Cares: Catch-up or Calendar Flex.",
  "format": "worksheet",
  "status": "content_source_draft",
  "body_markdown": "# Catch-up Choice Board\n\nUse the selected passage or curriculum evidence.\n\n1. Record what the evidence directly says.\n2. Mark interpretation, framework choice, or prudential judgment separately.\n3. Identify the evidence supporting each conclusion.\n4. Write one careful application.\n5. Put a question mark beside anything the evidence does not settle.\n"
}
