{
  "resource_id": "T1-L16-P01-authority-context-sort",
  "lesson_id": "T1-L16",
  "title": "Authority and Context Sort",
  "purpose": "Support the Authority and Context Sort activity for Second Temple Context without a New Authority.",
  "format": "worksheet",
  "status": "content_source_draft",
  "body_markdown": "# Authority and Context Sort\n\nClassify example claims as **canonical doctrine**, **historical context**, **textual evidence**, or **later interpretation**.\n\nFor each, state what the source can and cannot establish.\n"
}