{
  "resource_id": "T3-L26-P01-church-worship-and-mission-text-inference-and-practice-review-claim-audit",
  "lesson_id": "T3-L26",
  "title": "Church, Worship, and Mission: Text, Inference, and Practice Review Claim Audit",
  "purpose": "Support the primary activity for Church, Worship, and Mission: Text, Inference, and Practice Review.",
  "format": "worksheet",
  "status": "content_source_draft",
  "body_markdown": "# Devotion, Fellowship, Breaking Bread, and Prayer Claim Audit\n\n1. Read Acts 2:42-47.\n2. Record two direct observations.\n3. State the supported meaning.\n4. Name one interpretive limit or guardrail.\n5. Name one faithful response.\n"
}
