{
  "resource_id": "K3-L24-P01-god-ends-death-and-tears-story-path",
  "lesson_id": "K3-L24",
  "title": "God Ends Death and Tears Story Path",
  "purpose": "Support the primary activity for God Ends Death and Tears.",
  "format": "worksheet",
  "status": "content_source_draft",
  "body_markdown": "# The Bronze Serpent Story Path\n\n1. Read Numbers 21:4-9.\n2. Record two direct observations.\n3. State the supported meaning.\n4. Name one interpretive limit or guardrail.\n5. Name one faithful response.\n"
}
