{
  "body_markdown": "# God Dwells with His People Forever Story Path\n\nSupport the primary activity for K5-L24 - God Dwells with His People Forever.\n\n## Use\n- Lesson: K5-L24 - God Dwells with His People Forever\n- Big idea: God's final family includes people from the nations living in His renewed creation.\n- Primary reading: Revelation 21:1-7, 22-27\n\n## Evidence moves\n1. Record direct observations.\n2. Mark interpretation or canonical synthesis separately.\n3. For historical claims, record the external source and confidence level.\n4. State one faithful response without upgrading inference into explicit text.\n",
  "format": "worksheet",
  "lesson_id": "K5-L24",
  "purpose": "Support the primary activity for K5-L24 - God Dwells with His People Forever.",
  "resource_id": "K5-L24-P01-god-dwells-with-his-people-forever-story-path",
  "status": "content_source_draft",
  "title": "God Dwells with His People Forever Story Path"
}