{
  "body_markdown": "# Churches of Christ in Aotearoa New Zealand Claim Audit\n\nSupport the primary activity for T5-L12 - Churches of Christ in Aotearoa New Zealand.\n\n## Use\n- Lesson: T5-L12 - Churches of Christ in Aotearoa New Zealand\n- Big idea: Local history should be documented from reliable evidence without treating movement history as the beginning of Christ's church.\n- Primary reading: Acts 17:22-31; selected local historical sources\n\n## Evidence moves\n1. Record direct observations.\n2. Mark interpretation or canonical synthesis separately.\n3. For historical claims, record the external source and confidence level.\n4. State one faithful response without upgrading inference into explicit text.\n\n## Publication hold\nDo not publish post-biblical historical claims until the relevant primary/local source packet has been verified and cited.\n",
  "format": "worksheet",
  "lesson_id": "T5-L12",
  "purpose": "Support the primary activity for T5-L12 - Churches of Christ in Aotearoa New Zealand.",
  "resource_id": "T5-L12-P01-churches-of-christ-in-aotearoa-new-zealand-claim-audit",
  "status": "content_source_draft",
  "title": "Churches of Christ in Aotearoa New Zealand Claim Audit"
}