{
  "body_markdown": "# Jesus Is King: Catch-up or Calendar Flex Story Path\n\nSupport the primary activity for Jesus Is King: Catch-up or Calendar Flex.\n\n## Use\n- Lesson: K4-L28 - Jesus Is King: Catch-up or Calendar Flex\n- Big idea: The operating calendar may use this slot for catch-up, holidays, or a congregation-specific teaching need.\n- Primary reading: To be selected by curriculum editor\n\n## Activity\nUse this printable with the lesson's primary activity. Keep direct textual observation separate from synthesis, inference, framework position, and application.\n",
  "format": "worksheet",
  "lesson_id": "K4-L28",
  "purpose": "Support the primary activity for Jesus Is King: Catch-up or Calendar Flex.",
  "resource_id": "K4-L28-P01-jesus-is-king-catch-up-or-calendar-flex-story-path",
  "status": "content_source_draft",
  "title": "Jesus Is King: Catch-up or Calendar Flex Story Path"
}