{
  "resource_id": "Y3-L26-P01-jesus-gospel-and-discipleship-text-inference-and-practice-review-evidence-grid",
  "lesson_id": "Y3-L26",
  "title": "Jesus, Gospel, and Discipleship: Text, Inference, and Practice Review Evidence Grid",
  "purpose": "Support the primary activity for Jesus, Gospel, and Discipleship: Text, Inference, and Practice Review.",
  "format": "worksheet",
  "status": "content_source_draft",
  "body_markdown": "# Jesus Announces the Kingdom Evidence Grid\n\n1. Read Mark 1:14-20; Luke 4:16-21.\n2. Record two direct observations.\n3. State the supported meaning.\n4. Name one interpretive limit or guardrail.\n5. Name one faithful response.\n"
}
