{
  "resource_id": "Y3-L10-P01-prayer-wealth-and-trust-evidence-grid",
  "lesson_id": "Y3-L10",
  "title": "Prayer, Wealth, and Trust Evidence Grid",
  "purpose": "Support the primary activity for Prayer, Wealth, and Trust.",
  "format": "worksheet",
  "status": "content_source_draft",
  "body_markdown": "# Prayer, Wealth, and Trust Evidence Grid\n\n1. Read Matthew 6:1-34.\n2. Record two direct observations.\n3. State the supported meaning.\n4. Name one interpretive limit or guardrail.\n5. Name one faithful response.\n"
}
