{
  "resource_id": "T4-L06-P01-science-method-and-philosophical-naturalism-claim-audit",
  "lesson_id": "T4-L06",
  "title": "Science, Method, and Philosophical Naturalism Claim Audit",
  "purpose": "Support the primary activity for Science, Method, and Philosophical Naturalism.",
  "format": "worksheet",
  "status": "content_source_draft",
  "body_markdown": "# Devotion, Fellowship, Breaking Bread, and Prayer Claim Audit\n\n1. Read Acts 2:42-47.\n2. Record two direct observations.\n3. State the supported meaning.\n4. Name one interpretive limit or guardrail.\n5. Name one faithful response.\n"
}
