{
  "resource_id": "Y3-L12-P01-how-to-read-parables-evidence-grid",
  "lesson_id": "Y3-L12",
  "title": "How to Read Parables Evidence Grid",
  "purpose": "Support the primary activity for How to Read Parables.",
  "format": "worksheet",
  "status": "content_source_draft",
  "body_markdown": "# How to Read Parables Evidence Grid\n\n1. Read Luke 10:25-37; 15:1-32.\n2. Record two direct observations.\n3. State the supported meaning.\n4. Name one interpretive limit or guardrail.\n5. Name one faithful response.\n"
}
