{
  "body_markdown": "# Jesus Is King: Family Prayer and Service Flex Story Path\n\nSupport the primary activity for Jesus Is King: Family Prayer and Service Flex.\n\n## Use\n- Lesson: K4-L29 - Jesus Is King: Family Prayer and Service Flex\n- Big idea: A flexible unit may reinforce the cycle through a family prayer, service, or generosity practice.\n- Primary reading: To be selected by curriculum editor\n\n## Activity\nUse this printable with the lesson's primary activity. Keep direct textual observation separate from synthesis, inference, framework position, and application.\n",
  "format": "worksheet",
  "lesson_id": "K4-L29",
  "purpose": "Support the primary activity for Jesus Is King: Family Prayer and Service Flex.",
  "resource_id": "K4-L29-P01-jesus-is-king-family-prayer-and-service-flex-story-path",
  "status": "content_source_draft",
  "title": "Jesus Is King: Family Prayer and Service Flex Story Path"
}