{
  "resource_id": "T3-L14-P01-women-and-men-in-the-work-of-the-church-claim-audit",
  "lesson_id": "T3-L14",
  "title": "Women and Men in the Work of the Church Claim Audit",
  "purpose": "Support the primary activity for Women and Men in the Work of the Church.",
  "format": "worksheet",
  "status": "content_source_draft",
  "body_markdown": "# Devotion, Fellowship, Breaking Bread, and Prayer Claim Audit\n\n1. Read Acts 2:42-47.\n2. Record two direct observations.\n3. State the supported meaning.\n4. Name one interpretive limit or guardrail.\n5. Name one faithful response.\n"
}
