{
  "resource_id": "K3-L28-P01-god-rescues-catch-up-or-calendar-flex-story-path",
  "lesson_id": "K3-L28",
  "title": "God Rescues: Catch-up or Calendar Flex Story Path",
  "purpose": "Support the primary activity for God Rescues: Catch-up or Calendar Flex.",
  "format": "worksheet",
  "status": "content_source_draft",
  "body_markdown": "# The Bronze Serpent Story Path\n\n1. Read Numbers 21:4-9.\n2. Record two direct observations.\n3. State the supported meaning.\n4. Name one interpretive limit or guardrail.\n5. Name one faithful response.\n"
}
