{
  "resource_id": "T3-L13-P01-deacons-and-organised-service-claim-audit",
  "lesson_id": "T3-L13",
  "title": "Deacons and Organised Service Claim Audit",
  "purpose": "Support the primary activity for Deacons and Organised Service.",
  "format": "worksheet",
  "status": "content_source_draft",
  "body_markdown": "# Devotion, Fellowship, Breaking Bread, and Prayer Claim Audit\n\n1. Read Acts 2:42-47.\n2. Record two direct observations.\n3. State the supported meaning.\n4. Name one interpretive limit or guardrail.\n5. Name one faithful response.\n"
}
