{
  "resource_id": "K4-L10-P01-elijah-confronts-false-worship-story-path",
  "lesson_id": "K4-L10",
  "title": "Elijah Confronts False Worship Story Path",
  "purpose": "Support the primary activity for Elijah Confronts False Worship.",
  "format": "worksheet",
  "status": "content_source_draft",
  "body_markdown": "# Elijah Confronts False Worship Story Path\n\n**Lesson:** K4-L10 - Elijah Confronts False Worship\n\n## Purpose\n\nSupport the primary activity for Elijah Confronts False Worship.\n\n## Instructions\n\n1. Read the principal passage.\n2. Record direct observations.\n3. Separate interpretation from application.\n4. Name one faithful response.\n\n## Text\n\n1 Kings 18:20-39\n\n## Big idea\n\nThe Lord alone is God and deserves the people's allegiance.\n\n## Guardrails\n\nTell the confrontation without celebrating violence or ridicule as the lesson's moral centre. | Do not teach that dramatic signs are the normal test of faithful worship today.\n"
}
