{
  "resource_id": "Y3-L18-P01-jesus-is-crucified-evidence-grid",
  "lesson_id": "Y3-L18",
  "title": "Jesus Is Crucified Evidence Grid",
  "purpose": "Support the primary activity for Jesus Is Crucified.",
  "format": "worksheet",
  "status": "content_source_draft",
  "body_markdown": "# Jesus Announces the Kingdom Evidence Grid\n\n1. Read Mark 1:14-20; Luke 4:16-21.\n2. Record two direct observations.\n3. State the supported meaning.\n4. Name one interpretive limit or guardrail.\n5. Name one faithful response.\n"
}
