{
  "resource_id": "K4-L13-P01-jesus-is-born-as-king-story-path",
  "lesson_id": "K4-L13",
  "title": "Jesus Is Born as King Story Path",
  "purpose": "Support the primary activity for Jesus Is Born as King.",
  "format": "worksheet",
  "status": "content_source_draft",
  "body_markdown": "# Jesus Is Born as King Story Path\n\n**Lesson:** K4-L13 - Jesus Is Born as King\n\n## Purpose\n\nSupport the primary activity for Jesus Is Born as King.\n\n## Instructions\n\n1. Read the principal passage.\n2. Record direct observations.\n3. Separate interpretation from application.\n4. Name one faithful response.\n\n## Text\n\nMatthew 2:1-12; Luke 1:30-33\n\n## Big idea\n\nJesus was born as the promised ruler from David's line.\n\n## Guardrails\n\nKeep the birth narrative centred on Jesus as promised king; do not turn Herod's violence into frightening detail. | Distinguish Matthew's magi from later traditions about their number, names, or timing.\n"
}