{
  "resource_id": "K4-L16-P01-the-beatitudes-story-path",
  "lesson_id": "K4-L16",
  "title": "The Beatitudes Story Path",
  "purpose": "Support the primary activity for The Beatitudes.",
  "format": "worksheet",
  "status": "content_source_draft",
  "body_markdown": "# The Beatitudes Story Path\n\n**Lesson:** K4-L16 - The Beatitudes\n\n## Purpose\n\nSupport the primary activity for The Beatitudes.\n\n## Instructions\n\n1. Read the principal passage.\n2. Record direct observations.\n3. Separate interpretation from application.\n4. Name one faithful response.\n\n## Text\n\nMatthew 5:1-12\n\n## Big idea\n\nJesus described the character and hope of people under God's reign.\n\n## Guardrails\n\nPresent the Beatitudes as kingdom-shaped blessing and character, not a formula guaranteeing comfort now. | Do not imply grief, poverty, or persecution are automatically signs of superior spirituality.\n"
}