{
  "body_markdown": "# History, Hope, and Independent Faith: Local or Seasonal Flex Claim Audit\n\nSupport the primary activity for T5-L30 - History, Hope, and Independent Faith: Local or Seasonal Flex.\n\n## Use\n- Lesson: T5-L30 - History, Hope, and Independent Faith: Local or Seasonal Flex\n- Big idea: A flexible unit may address a local congregational event or season without altering the canonical core.\n- Primary reading: To be selected by curriculum editor\n\n## Evidence moves\n1. Record direct observations.\n2. Mark interpretation or canonical synthesis separately.\n3. For historical claims, record the external source and confidence level.\n4. State one faithful response without upgrading inference into explicit text.\n",
  "format": "worksheet",
  "lesson_id": "T5-L30",
  "purpose": "Support the primary activity for T5-L30 - History, Hope, and Independent Faith: Local or Seasonal Flex.",
  "resource_id": "T5-L30-P01-history-hope-and-independent-faith-local-or-seasonal-flex-claim-audit",
  "status": "content_source_draft",
  "title": "History, Hope, and Independent Faith: Local or Seasonal Flex Claim Audit"
}