{
  "resource_id": "T2-L21-P01-conversion-narratives-in-acts-claim-audit",
  "lesson_id": "T2-L21",
  "title": "Conversion Narratives in Acts Claim Audit",
  "purpose": "Support the primary activity for Conversion Narratives in Acts.",
  "format": "worksheet",
  "status": "content_source_draft",
  "body_markdown": "# Conversion Narratives in Acts Claim Audit\n\n1. Read Acts 2:36-41; 8:26-39; 10:34-48; 16:25-34.\n2. Record two direct observations.\n3. State the supported meaning.\n4. Name one faithful response.\n"
}