{
  "resource_id": "K2-L21-P01-jesus-promises-the-spirit-story-path",
  "lesson_id": "K2-L21",
  "title": "Jesus Promises the Spirit Story Path",
  "purpose": "Support the primary activity for Jesus Promises the Spirit.",
  "format": "worksheet",
  "status": "content_source_draft",
  "body_markdown": "# Jesus Promises the Spirit Story Path\n\n1. Read John 14:15-18, 25-27.\n2. Record two direct observations.\n3. State the supported meaning.\n4. Name one faithful response.\n"
}